Batsmen,Team,Batting Style,Bowling Style,Playing Role,Image,Description
Jason Jonathan Roy,England,Right hand Bat,Opening Batter,S Snater (cousin),"https://img1.hscicdn.com/image/upload/f_auto,t_ds_square_w_160/lsci/db/PICTURES/CMS/319700/319791.png",If there was any doubt over the value of Jason Roy to England's limited-overs team - and there probably shouldn't have been - it was dispelled on the way to their World Cup triumph of 2019.
Tom Banton,England,Right hand Bat,Wicketkeeper,Opening Batter,"https://img1.hscicdn.com/image/upload/f_auto,t_ds_square_w_160/lsci/db/PICTURES/CMS/323000/323099.png","Tom Banton was the breakout star of the 2019 domestic season as his flamboyant strokemaking at the top of the Somerset order catapulted him into England's T20 squad and drew attention from franchises from around the world. A tall, inventive player who has drawn regular comparisons with Kevin Pietersen and Jos Buttler, Banton's most eye-catching shots are his hockey-inspired reverse-slaps and scoops, though he is equally adept driving straight down the ground and hitting through midwicket. "
James Michael Vince,England,Right hand Bat,Right arm Medium,Batter,"https://img1.hscicdn.com/image/upload/f_auto,t_ds_square_w_160/lsci/db/PICTURES/CMS/323000/323001.png","With a wide range of strokes and an ability to time the ball shared by few, it was understandable that England's selectors kept providing opportunities to James Vince."
Moeen Munir Ali,England,Moe,Left hand Bat,Right arm Offbreak,"https://img1.hscicdn.com/image/upload/f_auto,t_ds_square_w_160/lsci/db/PICTURES/CMS/316500/316557.png","Moeen Ali was tipped for the top long before he won his Test debut at the start of 2014. But, after building a reputation as an elegant batter, it was his offspin bowling that earned him the call-up when England were left reeling from the surprise retirement of Graeme Swann."
Eoin Joseph Gerard Morgan,England,Moggie,Left hand Bat,Right arm Medium,"https://img1.hscicdn.com/image/upload/f_auto,t_ds_square_w_160/lsci/db/PICTURES/CMS/316500/316564.png","Eoin Morgan became England's ODI captain in slightly chaotic circumstances less than two months before the 2015 World Cup and was less than enamoured with an entirely inadequate campaign. What he observed, not just from his own side's lacklustre display, but the inspiration provided by Brendon McCullum's New Zealand side, convinced him an entirely new approach was necessary, with a policy of no fear (and no retribution) at its heart. It required a man of strong will not just to say it, but to implement it, but Morgan did so, seeking to fashion an England side that would play with courage and be impervious to pressure or criticism."
Samuel William Billings,England,Right hand Bat,Wicketkeeper,Wicketkeeper Batter,"https://img1.hscicdn.com/image/upload/f_auto,t_ds_square_w_160/lsci/db/PICTURES/CMS/322900/322932.png","Sam Billings, an energetic and inventive wicketkeeper-batter with a penchant for the white-ball game, slots into a long line of illustrious Kent keepers including Les Ames, Godfrey Evans, Alan Knott and Geraint Jones. Billings is an all-round sportsman who turned down a football trial with Tottenham Hotspur to go on a cricket tour at county level, once woke up in an infirmary after being spear tackled in a rugby union game, achieved county junior level in tennis, and is highly adept at squash and racquets."
Liam Andrew Dawson,England,"Daws, Lemmy",Right hand Bat,Slow Left arm Orthodox,"https://img1.hscicdn.com/image/upload/f_auto,t_ds_square_w_160/lsci/db/PICTURES/CMS/323100/323109.png","The selection of Liam Dawson in England's World T20 squad in 2016 carried a message of hope for all cricketers dutifully plying their trade on the county circuit. In Hampshire's T20 campaign of 2015 Dawson played two games, scored three runs in one knock and did not take a wicket; he scored three in his solitary T20 innings. With his career faltering, he was loaned out to Essex for a month. Then, on his return to Hampshire, came a remarkable transformation."
Christopher James Jordan,England,CJ,Right hand Bat,Right arm Fast medium,"https://img1.hscicdn.com/image/upload/f_auto,t_ds_square_w_160/lsci/db/PICTURES/CMS/316600/316623.png","Chris Jordan, a fast bowler with a level-headed calmness and a fearsome yorker, found his niche as a death specialist in T20 cricket for England after initially breaking through as a bowling allrounder in Tests and ODIs. "
Adil Usman Rashid,England,"Dilly, Hoover",Right hand Bat,Legbreak,"https://img1.hscicdn.com/image/upload/f_auto,t_ds_square_w_160/lsci/db/PICTURES/CMS/319700/319741.png","Adil Rashid did much to set right English cricket's troubled relationship with legspin when he established himself as the country's leading white-ball spinner in 2015 and four years later was a key part of their World Cup-winning side. At the time of Rashid's recall to the limited-overs set-up in 2015, no legspinner had taken more than five white-ball wickets for England; over the next six years, Rashid took more than 200."
Saqib Mahmood,England,Right hand Bat,Right arm Fast medium,Bowler,"https://img1.hscicdn.com/image/upload/f_auto,t_ds_square_w_160/lsci/db/PICTURES/CMS/323000/323019.png","Saqib Mahmood announced himself as a bowler of international class during England's ODI series against Pakistan in 2021. England were forced to pick a completely new squad at short notice after a number of Covid-19 cases were detected in their initial group leaving Mahmood to take the new ball in the first ODI in Cardiff; he dismissed Imam-ul-Haq and Babar Azam inside three balls, finished with 4 for 42, and was named player of the series as England romped to a 3-0 win."
Tymal Solomon Mills,England,Right hand Bat,Left arm Fast,Bowler,"https://img1.hscicdn.com/image/upload/f_auto,t_ds_square_w_160/lsci/db/PICTURES/CMS/323100/323104.png","Tymal Mills won an England recall for the 2021 T20 World Cup after four-and-a-half years in the international wilderness, during which time regular injuries had threatened his career. Mills, one of the most explosive fast bowlers in English cricket and an innovative thinker about the short-form game, was diagnosed with a congenital back condition in 2015 - his spinal cord and vertebrae are unusually close together and bowling fast too often can agitate his spinal cord - which consigned him to a career as a T20 specialist but he embraced life on the franchise circuit."
Brandon Alexander King,West Indies,Right hand Bat,Top order Batter,West Indies,"https://img1.hscicdn.com/image/upload/f_auto,t_ds_square_w_160/lsci/db/PICTURES/CMS/321900/321983.png","Brandon King got his start as a solid middle-order batter for Jamaica before a promotion to the top order in the CPL unlocked his power-hitting potential, and culminated in a call-up to West Indies' white-ball side."
Shai Diego Hope,West Indies,Right hand Bat,Wicketkeeper,Wicketkeeper Batter,"https://img1.hscicdn.com/image/upload/f_auto,t_ds_square_w_160/lsci/db/PICTURES/CMS/320100/320122.png","Shai Hope made his Test debut as a 21-year-old, having played just 14 first-class matches at the time. But few in the Caribbean doubted his talent as a batsman. Clive Lloyd gave him his West Indies cap, and coach Stuart Law insisted that he only needed one innings to get going. The world eventually got to know why the boy from Barbados was rated so highly when he became the first player, in 534 first-class matches, to score a hundred in each innings at Headingley."
Nicholas Pooran,West Indies,Left hand Bat,Right arm Offbreak,Wicketkeeper,"https://img1.hscicdn.com/image/upload/f_auto,t_ds_square_w_160/lsci/db/PICTURES/CMS/320100/320109.png","Nicholas Pooran confirmed his status as one of the most exciting young batting talents in the modern game with a sublime innings of 118 off 103 in West Indies' defeat to Sri Lanka at the 2019 World Cup, but only four years earlier the idea that he would play international cricket seemed fanciful."
Darren Michael Bravo,West Indies,Left hand Bat,Right arm Medium,Occasional Wicketkeeper,"https://img1.hscicdn.com/image/upload/f_auto,t_ds_square_w_160/lsci/db/PICTURES/CMS/316600/316616.png","Darren Bravo is living proof that imitation is the best form of flattery and learning. Only he chose to do it with one of the most inimitable masters of the game. To try to imitate is one thing, to pull it off at Test level, to imbibe it so much that it becomes you, is quite another. Brian Lara's cousin and Dwayne Bravo's half-brother, the younger Bravo, used to watch cricket only for Lara. As soon as Lara would get out, Bravo would switch off the TV and go out to bat."
Kieron Adrian Pollard,West Indies,Right hand Bat,Right arm Medium,Batting Allrounder,"https://img1.hscicdn.com/image/upload/f_auto,t_ds_square_w_160/lsci/db/PICTURES/CMS/320100/320107.png","Kieron Pollard had a batting average of 11.30 from 15 ODIs and 17.20 from 10 T20Is when he became the joint-biggest buy at the IPL player auction in January 2010. Mumbai Indians weren't paying $750,000 (plus an undisclosed amount to break a tie with three other franchises) for Pollard's international record; they were shelling out all that money for the fearsome hitting power he had shown in domestic T20 action - most notably while smashing 54 off 18 balls for T&T against New South Wales during the 2009 Champions League T20."
Jason Omar Holder,West Indies,Right hand Bat,Right arm Medium fast,Bowling Allrounder,"https://img1.hscicdn.com/image/upload/f_auto,t_ds_square_w_160/lsci/db/PICTURES/CMS/316600/316673.png","Jason Holder was seen as a future talent until a selection panel headed by former World Cup-winner Clive Lloyd appointed him West Indies' ODI captain in 2014. Holder was only 23 at the time, and was still making his way as a fast bowler and a lower-middle order batsman. Less than a year later, he took over the Test team too, indicating how much the WICB and men in the know - ranging from Viv Richards to Brian Lara to Tony Cozier - believed in this man, who comes across as remarkably level-headed and mature for someone so young. "
Romario Shepherd,West Indies,Right hand Bat,Right arm Fast medium,Bowling Allrounder,"https://img1.hscicdn.com/image/upload/f_auto,t_ds_square_w_160/lsci/db/PICTURES/CMS/322000/322037.png",
Odean Fabian Smith,West Indies,Right hand Bat,Right arm Fast medium,Bowling Allrounder,"https://img1.hscicdn.com/image/upload/f_auto,t_h_100_2x/lsci/db/PICTURES/CMS/348100/348147.4.jpg",
Fabian Anthony Allen,West Indies,Right hand Bat,Slow Left arm Orthodox,Bowling Allrounder,"https://img1.hscicdn.com/image/upload/f_auto,t_ds_square_w_160/lsci/db/PICTURES/CMS/321900/321999.png",
Akeal Jerome Hosein,West Indies,Left hand Bat,Slow Left arm Orthodox,Bowler,"https://img1.hscicdn.com/image/upload/f_auto,t_ds_square_w_160/lsci/db/PICTURES/CMS/321900/321939.png","Akeal Hosein was handed a chance to impress for West Indies in Bangladesh in early 2021 after several senior players opted out of the tour, but his opportunity had been a long time coming. "
Rovman Powell,West Indies,Right hand Bat,Right arm Medium fast,Middle order Batter,"https://img1.hscicdn.com/image/upload/f_auto,t_ds_square_w_160/lsci/db/PICTURES/CMS/322100/322172.png","A middle-order batter who bowls occasional medium pace, Rovman Powell has been a semi-regular presence in West Indies' white-ball squads from the mid-2010s without quite nailing down a spot. "
Liam Stephen Livingstone,England,Right hand Bat,Legbreak,Batting Allrounder,"https://img1.hscicdn.com/image/upload/f_auto,t_ds_square_w_160/lsci/db/PICTURES/CMS/323100/323103.png","The sense that Liam Livingstone is a domineering batting talent who will end up playing all three formats for England was strengthened by an excellent maiden Championship double-century for Lancashire against Warwickshire at Old Trafford in 2017. He had begun the season billed as the ""belligerent face of England's next generation"" after a successful England Lions tour of Sri Lanka, and England took an early look at him with two T20 appearances against South Africa before deciding that he needed more time to craft his game at county level. That double-hundred suggested his research was coming along just fine."
Philip Dean Salt,England,Right hand Bat,Right arm Offbreak,Wicketkeeper,"https://img1.hscicdn.com/image/upload/f_auto,t_ds_square_w_160/lsci/db/PICTURES/CMS/324200/324245.png","Phil Salt's fearless ball-striking at the top of the Sussex order earned him attention from across the global T20 circuit and a maiden England call-up in 2019, though he was made to wait until 2021 for his debut when he performed a passable impression of Jason Roy in the Covid-hit ODI series against Pakistan."
Harry Cherrington Brook,England,Right hand Bat,Right arm Medium,Batter,"https://img1.hscicdn.com/image/upload/f_auto,t_ds_square_w_160/lsci/db/PICTURES/CMS/324200/324246.png","A former England U19s captain, Harry Brook announced himself as a player with a bright future with a remarkable T20 Blast season in 2020, averaging 55 and striking at 163 in the group stages despite batting in the middle order."
George Henry Simmons Garton,England,Left hand Bat,Left arm Fast,Bowling Allrounder,"https://img1.hscicdn.com/image/upload/f_auto,t_ds_square_w_160/lsci/db/PICTURES/CMS/324300/324377.png","A left-arm quick and promising batter, in 2021 George Garton began to live up to the promise that had seen him drafted in as cover on an Ashes tour aged just 20. Encouraging displays for Sussex led to an England ODI call-up - though Covid-19 scuppered chances of a debut - and he went on to help Southern Brave to glory in the inaugural men's Hundred, subsequently winning an IPL deal to play for Royal Challengers Bangalore."
Reece James William Topley,England,Right hand Bat,Left arm Fast medium,Bowler,"https://img1.hscicdn.com/image/upload/f_auto,t_ds_square_w_160/lsci/db/PICTURES/CMS/322900/322910.png","A left-arm seamer with a fearsome yorker but a chequered injury history, Reece Topley's career was in peril before his 25th birthday as he suffered a series of stress fractures that left him wondering whether he would ever be able to play again."
Kyle Rico Mayers,West Indies,Left hand Bat,Right arm Medium,Batting Allrounder,"https://img1.hscicdn.com/image/upload/f_auto,t_ds_square_w_160/lsci/db/PICTURES/CMS/322000/322024.png","A left-handed batsman who bowls useful medium pace, Kyle Mayers travelled to England as a reserve for West Indies in 2020 before making his T20I debut in New Zealand later in the year. "
Aaron James Finch,Australia,Finchy,Right hand Bat,Slow Left arm Orthodox,"https://img1.hscicdn.com/image/upload/f_auto,t_ds_square_w_160/lsci/db/PICTURES/CMS/316500/316533.png","A solidly built, aggressive batter from a country town in Victoria, Aaron Finch ascended to become Australia's ODI and T20I captain, leading his country to their first T20 World Cup triumph in 2021. "
Benjamin Reginald McDermott,Australia,Right hand Bat,Right arm Medium,Wicketkeeper,"https://img1.hscicdn.com/image/upload/f_auto,t_ds_square_w_160/lsci/db/PICTURES/CMS/321500/321563.png","Ben McDermott did not follow the family trend of bowling fast like his father Craig and brother Alister, but has instead made a name for himself as a batsman and some-time wicketkeeper. After making his BBL debut for the Brisbane Heat in 2013-14, his initial forays into state cricket came for Queensland, but in 2015 he signed a rookie deal with Tasmania. After a few years of hovering on the fringes of domestic cricket, McDermott blasted into the spotlight in the 2016-17 BBL when he smashed 114 off 52 balls to set the Hobart Hurricanes on the path to a remarkable win at Etihad Stadium, chasing down the Melbourne Renegades' score of 222, which had been the highest total in BBL history. His innings was also, at the time, the second-highest individual score in BBL history.ESPNcricinfo staff"
Joshua Patrick Inglis,Australia,Right hand Bat,Wicketkeeper,Wicketkeeper Batter,"https://img1.hscicdn.com/image/upload/f_auto,t_ds_square_w_160/lsci/db/PICTURES/CMS/324200/324232.png","Wicketkeeper-batter Josh Inglis, who was born in Leeds before relocating to Australia as a 14-year-old, moved quickly into the national reckoning over the last two years after finding his feet for both Western Australia and Perth Scorchers. A versatile and hard-hitting batter, he enjoyed a breakthrough Sheffield Shield season in 2020-21 with 585 runs including his first three first-class hundreds having previously churned out runs at grade level without quite making the step up. That followed consecutive 400-plus run seasons for Scorchers in the BBL - where his adaptability at moving from the top order to the middle was noted by selectors - and having continued to flay runs in county cricket for Leicestershire he was named in Australia's 2021 T20 World Cup despite not being part of any of the previous series.
ESPNcricinfo staff"
Glenn James Maxwell,Australia,Right hand Bat,Right arm Offbreak,Batting Allrounder,"https://img1.hscicdn.com/image/upload/f_auto,t_ds_square_w_160/lsci/db/PICTURES/CMS/316600/316657.png","One of the fastest scorers in world cricket, Glenn Maxwell has lit up the limited-overs formats and, at times, shown he can transfer that to the red ball. It is not just his power that worries opposing bowlers and captains. His ability to make unconventional shots appear routine - reverse sweeps and pulls, for example - makes it hard to set fields to cover all of his scoring areas. His audacity comes with risk, and he can exasperate as well as exhilarate, but at his best he can change a game in moments."
Steven Peter Devereux Smith,Australia,Steve Smith,Right hand Bat,Legbreak Googly,"https://img1.hscicdn.com/image/upload/f_auto,t_ds_square_w_160/lsci/db/PICTURES/CMS/316600/316609.png","In a career of twists and turns, Steven Smith started out as a legspinner and become Australia's best batter since Sir Donald Bradman, either side of having his career derailed by a ball-tampering scandal that saw him stripped of the captaincy and banned for 12 months."
Marcus Peter Stoinis,Australia,Right hand Bat,Right arm Medium,Batting Allrounder,"https://img1.hscicdn.com/image/upload/f_auto,t_ds_square_w_160/lsci/db/PICTURES/CMS/321500/321596.png","A powerful, versatile batter and medium-pace bowler, Marcus Stoinis has become a mainstay in Australia's limited-overs sides as well as a dominant player in the BBL and a sought-after player in the IPL. "
Matthew Scott Wade,Australia,Wadey,Left hand Bat,Right arm Medium,"https://img1.hscicdn.com/image/upload/f_auto,t_ds_square_w_160/lsci/db/PICTURES/CMS/316500/316594.png",It has been a career of reinvention for Matthew Wade as he went from Test wicketkeeper to specialist middle-order batsman to T20I World Cup winning wicketkeeper/finisher via a prolific run in domestic cricket when it appeared his international days were over.
Patrick James Cummins,Australia,Cummo,Right hand Bat,Right arm Fast,"https://img1.hscicdn.com/image/upload/f_auto,t_ds_square_w_160/lsci/db/PICTURES/CMS/316600/316692.png","Earmarked as a potential star from a young age, Pat Cummins made his Test debut as an 18-year-old but had to wait six years for his next appearance as injuries struck a body that could not withstand the workload. The bowler who emerged in 2017 was a thoroughbred quick who became one of the standout players in the world and, in late 2021, Australia's Test captain in dramatic circumstances."
Mitchell Aaron Starc,Australia,Left hand Bat,Left arm Fast,Bowler,"https://img1.hscicdn.com/image/upload/f_auto,t_ds_square_w_160/lsci/db/PICTURES/CMS/316600/316644.png","First there was Johnson, then there was Starc. A left-armer called Mitchell has been a staple of Australia's attack for more than a decade and seems set to remain so for the foreseeable future. While Johnson was more express, Starc is still quick enough to make life uncomfortable for opposition batsmen, especially with the bounce gained from his 1.96m height - and boasts greater control of swing than his former colleague. Never was that shown to greater effect than during the 2015 World Cup, when Starc was at times unplayable, his inswingers rattling stumps and trapping batsmen in front throughout the competition. Not surprisingly he was named Player of the Tournament for his 22 victims at 10.18, and four years later he would claim 27 wickets at the World Cup in England when Australia's defence ended in the semi-finals."
Adam Zampa,Australia,Right hand Bat,Legbreak Googly,Bowler,"https://img1.hscicdn.com/image/upload/f_auto,t_ds_square_w_160/lsci/db/PICTURES/CMS/321500/321549.png","An energetic and competitive legspinner, Adam Zampa emerged in Australia's limited-overs squads in 2016 after a successful summer for South Australia and the Melbourne Stars. In T20, especially, he has proven a hard man to get away, with subtle changes of pace and variations, including a wrong'un and straight ball making up for a lack of prodigious turn. He's a (mullet-wearing) colourful character off the field, but in contrast, his bowling, focusing on control, is clinical."
Josh Reginald Hazlewood,Australia,Left hand Bat,Right arm Fast medium,Bowler,"https://img1.hscicdn.com/image/upload/f_auto,t_ds_square_w_160/lsci/db/PICTURES/CMS/316600/316622.png","A tall and accurate fast bowler who is unrelenting in his line and length, Josh Hazlewood became a fixture in Australia's Test attack as soon as he made his debut in December 2014. Although he was only 23 at the time, the baggy green had felt a long time coming, given that Hazlewood had been highly regarded for so long. At 17, he had become the youngest fast bowler to be selected by New South Wales, and at 19 he was in his first one-day international against England at Southampton, joining Craig McDermott and Ray Bright as the only Australian 19-year-olds to play the format so soon. Hazlewood was initially chosen for Australia's Test tour of India in late 2010 but was withdrawn due to a back stress injury, and it was not until four years later that he finally played his first Test, having added significant strength to his 196cm frame."
Pathum Nissanka Silva,Sri Lanka,Right hand Bat,Top order Batter,"Isipathana College, Colombo","https://img1.hscicdn.com/image/upload/f_auto,t_ds_square_w_160/lsci/db/PICTURES/CMS/323000/323070.png",
Mashtayage Danushka Gunathilaka,Sri Lanka,Dana,Left hand Bat,Right arm Offbreak,"https://img1.hscicdn.com/image/upload/f_auto,t_ds_square_w_160/lsci/db/PICTURES/CMS/319800/319857.png","A poised, attacking left-handed opener groomed in part at Sinhalese Sports Club, Danushka Gunathilaka was plucked from the domestic system largely on potential, and drafted into Sri Lanka's A team for the tour of New Zealand in mid-2015. He impressed on that trip, hitting two smart fifties from four innings, to finish as the team's second-highest run-scorer."
Weerahandige Inol Avishka Fernando,Sri Lanka,Right hand Bat,Right arm Medium fast,Opening Batter,"https://img1.hscicdn.com/image/upload/f_auto,t_ds_square_w_160/lsci/db/PICTURES/CMS/322900/322951.png","A bruising right-hander - though not without aptitude for deft touch - Avishka Fernando turned heads while representing St. Sebastian's College, Moratuwa, before making good on his promise at the national Under-19 level."
Kariyawasam Indipalage Charith Asalanka,Sri Lanka,Left hand Bat,Right arm Offbreak,Batting Allrounder,"https://img1.hscicdn.com/image/upload/f_auto,t_ds_square_w_160/lsci/db/PICTURES/CMS/348500/348599.png",
Pinnaduwage Wanindu Hasaranga de Silva,Sri Lanka,Right hand Bat,Legbreak,Allrounder,"https://img1.hscicdn.com/image/upload/f_auto,t_ds_square_w_160/lsci/db/PICTURES/CMS/322900/322946.png","A bruising lower-middle order batsman, and an aggressive legbreak bowler, Wanidu Hasaranga graduated from a strong Richmond College outfit, had a fine run in Sri Lanka's 2015 and 2016 Under-19 teams, and has made a promising start to his domestic cricket career."
Madagamagamage Dasun Shanaka,Sri Lanka,Right hand Bat,Right arm Medium,Allrounder,"https://img1.hscicdn.com/image/upload/f_auto,t_ds_square_w_160/lsci/db/PICTURES/CMS/328000/328058.png","An explosive middle-order batsman, and steady right-arm seam bowler, Dasun Shanaka worked his way into Sri Lanka's T20 side through several seasons of good performances for Sinhalese Sports Club. Born and educated in Negombo, Shanaka made his T20 international debut against Pakistan in August 2015, but it wasn't until the following domestic season that he achieved wide acclaim. Batting at No. 4 in an AIA Premier T20 match against Saracens Sports Club, Shanaka struck a Sri Lankan record 16 sixes in an innings worth 123 from 46 balls. That wasn't even his biggest T20 score of the last week. He had hit 131 off 48 balls against Galle Cricket Club one week earlier."
Lokuge Dinesh Chandimal,Sri Lanka,Right hand Bat,Right arm Offbreak,Wicketkeeper,"https://img1.hscicdn.com/image/upload/f_auto,t_ds_square_w_160/lsci/db/PICTURES/CMS/326000/326001.png","Dinesh Chandimal is among the most promising young batsman going around in Sri Lankan cricket. A technically sound batsman with strokes all around the wicket, Chandimal also stands out because of the maturity he shows at the crease and his temperament to build and pace an innings."
Chamika Karunaratne,Sri Lanka,Right hand Bat,Right arm Medium fast,Bowling Allrounder,"https://img1.hscicdn.com/image/upload/f_auto,t_ds_square_w_160/lsci/db/PICTURES/CMS/329900/329937.png",
